2	-15.876558	-47.836197	Espécie da Flora, pau-santo -Kielmeyera speciosaA.St.-Hil.	Espécie comum no Cerrado a casca de se tronco tem aspecto poroso, sendo extremamente macio, apresenta folhas coriáceas que caem no período da seca, florescem entre março e maio, suas flores apresentam tons brancos e rosadas e são polinizadas por abelhas. Os frutos secos aparecem de julho a setembro, não são comestíveis. Os frutos começam a abrir no final de agosto e as sementes aladas podem ser vistas, sua forma alada facilita a dispersão pelo vento. Sua reprodução é sincronizada com o período chuvoso, ou seja, os frutos maduros no final da seca lançam suas sementes que, com a chegada da chuva, tem mais chances de germinação.	3 imagens: visão ampla da árvore, detalhe dos frutos, sementes aladas em detalhe.
3	-15.877031	-47.836506	Espécie da flora,jacarandá-do-cerrado-Dalbergia miscolobiumBenth	A espécie apresenta um caule castanho- acinzentado com fissuras sinuosas por vezes, abrigam larvas de insetos que atraem aves como pica-pau. Perdem as folhas no período da seca, suas folhas compostas por 9 a 20 folíolos coriáceos, apresentando manchas circulares de cor preta decorrentes de infecção por fungos. Suas flores são pequenas, formando grandes inflorescências de cor violácea, podem ser observadas de novembro a maio e atraem vários tipos de insetos para fazer sua polinização, inclusive, abelhas grandes e pequenas. Seus frutos que aparecem de maio a julho, têm uma alta viabilidade, ou seja, alta taxa de germinação, podendo ficar por meses em dormência, e germinarem quando as primeiras chuvas caem. Possui frutos secos dispersos pelo vento.	3 imagens: Detalhe do caule, visão geral da árvore e detalhe das folhas.
5	-15.877075	-47.836643	Eriotheca pubescens(Mart. & Zucc.) Schott & Endl. paineira-do-cerrado	 A espécie possui ampladistribuição no Centro-Oeste, Nordeste e Sudeste. Não é endêmica do Brasil, geralmente flore em julho e agosto apresenta fruto em novembro. As sementes se localizam dentro da paina o que facilita sua dispersão pelo vento. Essa espécie apresenta folhas alternas, compostas palmadas. Árvore melífera belas flores claras, polinizada por abelhas. A paina que é produzida no fruto, quando maduro e aberto, é utilizada por aves para fazerem seus ninhos e também serve como recheio de travesseiros	3 imagens: copa da árvore, detalhe do fruto fechado, detalhe do fruto aberto exibindo a paina.
6	-15.877272	-47.836880	Cupinzeiro terrestre	Os cupins são insetos sociais (vivem em grandes colônias) da ordem Isoptera,formam ninhos que podem atingir forma de torre que são feitos de partículas de solo e excremento de cupins grudados com as secreções salivares dos operários. formam um dos grupos dominantes na fauna de solo de ecossistemas tropicais, exercendo um papel importante nos processos de ciclagem de nutrientes e formação de solo. Ao abrir túneis e construir seus ninhos, os cupins arejam e melhoram a estrutura do solo, além de movimentar verticalmente grande quantidade de partículas. Os termiteiros servem de abrigo a uma fauna diversa, incluindo artrópodes, vertebrados e outros grupos. Os ninhos velhos e abandonados servem de substrato para o desenvolvimento de várias de plantas. Devido a esse poder de modificar a estrutura dohabitat, os cupins podem ser incluídos entre os “engenheiros do ecossistema”.	3 imagens: visão do ninho, detalhe interno e cupins.
7	0	0	Fogo	 Existem duas causas principais de incêndios florestais no Cerrado, o fogo natural, principalmente causado por descargas elétricas, ocorre principalmente no período chuvoso, quando o teor de umidade na superfície do solo e na vegetação é mais elevado. Portanto a frequência e a intensidade do fogo são menores. Nesses casos, geralmente é um fogo rápido e benéfico, pois contribuem para germinação de semente, ciclagem de nutrientes entre outros benefícios. O fogo causado pelo homem tem aumentado, são incêndios de grande magnitude, ocasionando a degradação do ambiente, esgotamento das terras, erosão, perda da biodiversidade do cerrado, entre outros fatores negativos. Em alta frequência o fogo pode alterar as fitofisionomias do Cerrado, privilegiando as formações mais abertas.	2 imagens: visão geral das marcas de passagem de fogo e detalhe do tronco queimado.
12	0	0	Ouratea hexasperma- Vasoura-de-bruxa	Espécie amplamente distribuída no país apresenta folhas coriáceas levemente serrilhadas na bainha e espaçadas alternadamente nos ramos, frequentemente tem frutos com seis sementes daí o nome “hexasperma” (hexa= seis + sperma= semente). Quando aparece apenas dois frutículos, o fruto se assemelha ao “Mikey Mause” e servem de alimento para a fauna. As flores cor de amarelo ouro formam uma inflorescência muito bonita que chama atenção de polinizadores principalmente abelhas grandes. Essa inflorescência por vezes tem um aspecto ressecado pois é atacada por fungos/vírus formando um embruxameto que lhe imprime o nome popular de Vassoura-de-bruxa.	6 imagens: mostrando visão geral das flores, detalhes do aparelho reprodutivo evidenciando o gineceu (feminino) e o androceu (masculino), além da inflorescência ressacada que lembra as cerdas de vassoura.
23	0	0	Nascente do córrego Cabeça de Veado	Na Estação Ecológica do Jardim Botânico encontram-se várias nascentes que alimentam o córrego cabeça de Veado. Nascentes são aparecimento, na superfície do terreno de um lençol subterrâneo que dão origem a cursos d’água. Pesquisas realizadas no córrego cabeça de veado mostram que suas águas são referência em termos de qualidade e de biodiversidade, típicas de riachos que se mantém em seu estado primitivo. Ao se observar essas nascentes deve-se expandir o olhar para o ecossistema que integra os compartimentos terrestres e aquáticos, conhecidos como ecossistemas ripários.	7 imagens: apresentando detalhes da nascentes e organismos que, apesar de invisíveis a olho nu, fazem parte da biota do córrego, sendo importantes indicadores das qualidade de suas águas, além de um trecho do córrego já formado.
34	0	0	Gavinha	 Algumas espécies de plantas apresentam folhas modificadas que realizam outras funções além da fotossíntese, por exemplo, as gavinhas que são folhas modificadas lembrando molas. Essas estruturas têm como principal função fixar a planta, enrolando-se sobre suportes. Muitas por serem verdes, contendo clorofila, além de fixar auxiliam no processo de fotossíntese.	2 imagens mostrando uma espécie trepadeira e detalhe das gavinhas se fixando na espécie suporte.
